<!ELEMENT productlist (product+)>

<!ELEMENT product (name, price)>

<!ELEMENT name (#PCDATA)>
<!ELEMENT price (#PCDATA)>

<!ATTLIST name instock (true|false) #REQUIRED>
<!ATTLIST price currency (USD|CAD|EUR|PLN) #REQUIRED>
